Question                                                                                            , Reponse                                                                                                                                                                                                   , Categorie                                                                                           , SousTheme                                                          , Source
Comment présenter un papier à un colloque ?                                                         , Les modalités de soumission sont définies par chaque événement.                                                                                                                                           , Communication et Vie Institutionnelle                                                               , Publications                                                       , À vérifier
Les étudiants peuvent-ils publier des articles ?                                                    , Oui les travaux de qualité peuvent être publiés.                                                                                                                                                          , Communication et Vie Institutionnelle                                                               , Publications                                                       , À vérifier
Comment organiser un événement sponsorisé ?                                                         , En contactant l'administration pour discuter du projet.                                                                                                                                                   , Communication et Vie Institutionnelle                                                               , Événements                                                         , https://e-supptic.cm/contactez-nous/
Peut-on visiter le campus de SUP'PTIC ?                                                             , Il est recommandé de contacter l'administration pour organiser une visite du campus.                                                                                                                      , Vie Pratique                                                                                        , Visites                                                            , https://e-supptic.cm/contactez-nous/
Y a-t-il un système de transport pour les étudiants ?                                               , Oui SUP'PTIC dispose de bus de transport pour ses étudiants.                                                                                                                                              , Vie Pratique                                                                                        , Transport                                                          , https://e-supptic.cm/nos-plus/
Le campus est-il accessible aux personnes à mobilité réduite ?                                      , Les informations sur l'accessibilité du campus sont à vérifier auprès de l'administration.                                                                                                                , Vie Pratique                                                                                        , Accessibilité                                                      , À vérifier
Y a-t-il un parking pour les étudiants ?                                                            , Les informations sur les infrastructures de stationnement sont à vérifier.                                                                                                                                , Vie Pratique                                                                                        , Services annexes                                                   , À vérifier
Le campus est-il sécurisé ?                                                                         , SUP'PTIC assure la sécurité de ses étudiants et de ses infrastructures.                                                                                                                                   , Vie Pratique                                                                                        , Sécurité                                                           , À vérifier
Y a-t-il un règlement intérieur à SUP'PTIC ?                                                        , Oui comme tout établissement d'enseignement SUP'PTIC dispose d'un règlement intérieur.                                                                                                                    , Vie Pratique                                                                                        , Règlement                                                          , À vérifier
Comment réserver une salle pour un événement ?                                                      , Les procédures de réservation sont à vérifier auprès de l'administration.                                                                                                                                 , Vie Pratique                                                                                        , Réservation de salles                                              , À vérifier
Y a-t-il un service de photocopie sur le campus ?                                                   , Les services annexes disponibles sur le campus sont à vérifier.                                                                                                                                           , Vie Pratique                                                                                        , Services annexes                                                   , À vérifier
Où acheter des fournitures scolaires près de SUP'PTIC ?                                             , Des commerces de fournitures sont disponibles à proximité du campus.                                                                                                                                      , Vie Pratique                                                                                        , Fournitures                                                        , À vérifier
Y a-t-il des banques partenaires de SUP'PTIC ?                                                      , Les partenariats avec des institutions financières sont à vérifier.                                                                                                                                       , Vie Pratique                                                                                        , Services bancaires                                                 , À vérifier
Peut-on payer par mobile money ?                                                                    , Les modes de paiement acceptés sont à vérifier auprès du service financier.                                                                                                                               , Vie Pratique                                                                                        , Services bancaires                                                 , À vérifier
Y a-t-il un distributeur de billets sur le campus ?                                                 , Les services bancaires disponibles sur ou près du campus sont à vérifier.                                                                                                                                 , Vie Pratique                                                                                        , Services bancaires                                                 , À vérifier
Quel est le coût de la vie à Yaoundé pour un étudiant ?                                             , Le coût de la vie varie mais comprend logement transport restauration et fournitures.                                                                                                                     , Vie Pratique                                                                                        , Coût de la vie                                                     , À vérifier
Combien faut-il prévoir par mois pour vivre à Yaoundé ?                                             , Le budget mensuel dépend du mode de vie mais inclut environ 50000-150000 FCFA minimum.                                                                                                                    , Vie Pratique                                                                                        , Budget étudiant                                                    , À vérifier
Y a-t-il des jobs étudiants disponibles ?                                                           , Les opportunités de jobs étudiants sont à chercher localement.                                                                                                                                            , Vie Pratique                                                                                        , Emploi étudiant                                                    , À vérifier
SUP'PTIC aide-t-elle à trouver un job étudiant ?                                                    , Les informations sur l'aide à l'emploi étudiant sont à vérifier.                                                                                                                                          , Vie Pratique                                                                                        , Emploi étudiant                                                    , À vérifier
Comment trouver un stage à l'étranger ?                                                             , SUP'PTIC peut faciliter via ses partenariats internationaux.                                                                                                                                              , Vie Pratique                                                                                        , Stages internationaux                                              , À vérifier
Les stages à l'étranger sont-ils validés ?                                                          , Oui sous réserve de validation par l'administration.                                                                                                                                                      , Vie Pratique                                                                                        , Stages                                                             , À vérifier
Peut-on prolonger son stage ?                                                                       , Les modalités de prolongation de stage sont à discuter avec l'encadrant et l'administration.                                                                                                              , Vie Pratique                                                                                        , Stages                                                             , À vérifier
Comment rédiger un rapport de stage ?                                                               , Des directives sont fournies par les enseignants encadrants.                                                                                                                                              , Vie Pratique                                                                                        , Rapports                                                           , À vérifier
Y a-t-il des modèles de rapport de stage ?                                                          , Des modèles et guides sont généralement fournis par les départements.                                                                                                                                     , Vie Pratique                                                                                        , Rapports                                                           , À vérifier
Que faire en cas d'urgence sur le campus ?                                                          , Contacter les services de sécurité et suivre les procédures d'urgence.                                                                                                                                    , Vie Pratique                                                                                        , Urgences                                                           , À vérifier
Y a-t-il un plan d'évacuation ?                                                                     , Oui des plans de sécurité et d'évacuation sont en place.                                                                                                                                                  , Vie Pratique                                                                                        , Sécurité                                                           , À vérifier
Comment signaler un problème de sécurité ?                                                          , En contactant immédiatement le service de sécurité ou l'administration.                                                                                                                                   , Vie Pratique                                                                                        , Sécurité                                                           , À vérifier
Y a-t-il un comité hygiène et sécurité ?                                                            , Les instances de sécurité sont à vérifier.                                                                                                                                                                , Vie Pratique                                                                                        , Sécurité                                                           , À vérifier
Y a-t-il une assurance pour les étudiants ?                                                         , Les informations sur les assurances sont à vérifier.                                                                                                                                                      , Vie Pratique                                                                                        , Assurance                                                          , À vérifier
L'assurance est-elle obligatoire ?                                                                  , Les obligations en matière d'assurance sont à vérifier.                                                                                                                                                   , Vie Pratique                                                                                        , Assurance                                                          , À vérifier
Que couvre l'assurance étudiante ?                                                                  , Les garanties dépendent du type d'assurance souscrite.                                                                                                                                                    , Vie Pratique                                                                                        , Assurance                                                          , À vérifier
Comment déclarer un accident ?                                                                      , Suivre les procédures définies par l'assurance et l'administration.                                                                                                                                       , Vie Pratique                                                                                        , Procédures                                                         , À vérifier
Y a-t-il une couverture pour les stages ?                                                           , Les stages doivent être couverts par une assurance.                                                                                                                                                       , Vie Pratique                                                                                        , Assurance                                                          , À vérifier
L'école fournit-elle une assurance stage ?                                                          , Les modalités d'assurance stage sont à vérifier.                                                                                                                                                          , Vie Pratique                                                                                        , Assurance                                                          , À vérifier
Comment obtenir une attestation d'assurance ?                                                       , Auprès de son assureur ou du service concerné.                                                                                                                                                            , Vie Pratique                                                                                        , Procédures                                                         , À vérifier
Peut-on changer d'assurance en cours d'année ?                                                      , Selon les contrats et obligations.                                                                                                                                                                        , Vie Pratique                                                                                        , Assurance                                                          , À vérifier
Y a-t-il des partenaires assurance de SUP'PTIC ?                                                    , Les partenariats avec des assureurs sont à vérifier.                                                                                                                                                      , Vie Pratique                                                                                        , Conseils                                                           , À vérifier
Comment bien choisir son assurance étudiante ?                                                      , En comparant les offres et garanties selon ses besoins.                                                                                                                                                   , Vie Pratique                                                                                        , Conseils                                                           , À vérifier
Où manger près de SUP'PTIC ?                                                                        , Plusieurs restaurants et espaces de restauration sont disponibles dans les environs.                                                                                                                      , Vie Pratique                                                                                        , Restauration                                                       , À vérifier
Le campus est-il ouvert pendant les vacances ?                                                      , Les horaires d'ouverture pendant les périodes de congé sont à vérifier.                                                                                                                                   , Vie Pratique                                                                                        , Horaires                                                           , À vérifier
Peut-on suivre des cours en ligne pendant les vacances ?                                            , La plateforme E-learning est accessible pour l'apprentissage continu.                                                                                                                                     , Vie Pratique                                                                                        , E-learning                                                         , https://training.e-supptic.cm/
Y a-t-il une cafétéria sur le campus ?                                                              , Les informations sur les espaces de restauration sont à vérifier.                                                                                                                                         , Vie Pratique                                                                                        , Restauration                                                       , À vérifier
Quel est le coût moyen d'un logement étudiant à Yaoundé ?                                           , Le coût de la vie et du logement à Yaoundé varie selon les quartiers et doit être vérifié localement.                                                                                                     , Vie Pratique                                                                                        , Logement                                                           , À vérifier
SUP'PTIC forme-t-elle des formateurs ?                                                              , Oui la formation des formateurs fait partie des perspectives de SUP'PTIC.                                                                                                                                 , Programmes Académiques                                                                              , Formation des formateurs                                           , https://e-supptic.cm/a-propos-de-nous/
Y aura-t-il un Master professionnel en Sécurité et Audit des Systèmes ?                             , Oui SUP'PTIC prévoit l'introduction d'un Master professionnel en Sécurité et Audit des Systèmes avec financement du FSE.                                                                                  , Programmes Académiques                                                                              , Futures formations                                                 , https://e-supptic.cm/a-propos-de-nous/
Quelle est la durée du stage pour les Ingénieurs des Travaux de Télécommunications ?                , Le stage dure 2 mois.                                                                                                                                                                                     , Programmes Académiques                                                                              , Stages ITT                                                         , https://e-supptic.cm/ingenieur-des-travaux-de-telecommunications/
Quelle est la durée du stage pour les Ingénieurs des Télécommunications ?                           , Le stage dure 5 mois.                                                                                                                                                                                     , Programmes Académiques                                                                              , Stages Master                                                      , https://e-supptic.cm/ingenieur-des-telecommunications/
Quelle est la durée du stage au premier cycle management ?                                          , Le stage dure 2 mois.                                                                                                                                                                                     , Programmes Académiques                                                                              , Stages                                                             , https://e-supptic.cm/premier-cycle-yaounde/
Quelle est la durée du stage au second cycle management ?                                           , Le stage dure 5 mois.                                                                                                                                                                                     , Programmes Académiques                                                                              , Stages Master                                                      , https://e-supptic.cm/second-cycle-yaounde/
Combien de diplômes SUP'PTIC a-t-elle délivrés depuis sa création ?                                 , SUP'PTIC a délivré plus de 10941 diplômes.                                                                                                                                                                , Introduction                                                                                        , Historique de l'établissement                                      , https://e-supptic.cm/
