Question,Reponse,Categorie,SousTheme,Source
Quelles sont les démarches pour s’inscrire à SUP'PTIC Cameroun ?,"Pour vous inscrire à SUP'PTIC Cameroun, vous devez remplir un formulaire en ligne sur notre site officiel, soumettre les pièces justificatives requises, puis procéder au paiement des frais d'inscription. Une fois ces étapes complétées, vous recevrez une confirmation d'inscription.",Vie Étudiante,Inscription,https://e-supptic.cm/
Quels sont les horaires d’ouverture du service administratif de SUP'PTIC ?,Le service administratif est ouvert du lundi au vendredi de 8h00 à 17h00 sans interruption. Le service reste fermé les weekends et les jours fériés.,Vie Étudiante,Administration,https://e-supptic.cm/
Comment puis-je obtenir une attestation de scolarité ?,"Pour obtenir une attestation de scolarité, vous devez en faire la demande auprès du service des inscriptions via la plateforme en ligne ou directement au guichet administratif. L'attestation est généralement délivrée sous 48 heures.",Vie Étudiante,Documents administratifs,https://e-supptic.cm/
Quels sont les moyens de paiement acceptés pour les frais de scolarité ?,"SUP'PTIC Cameroun accepte les paiements par virement bancaire, mobile money, carte bancaire et paiement direct en espèces au guichet administratif.",Vie Étudiante,Paiements,https://e-supptic.cm/
Existe-t-il une bourse ou un soutien financier pour les étudiants en difficulté ?,"Oui, SUP'PTIC Cameroun offre des bourses d'excellence et des aides financières ponctuelles aux étudiants en situation de difficulté, sur dossier à déposer auprès du service social de l’établissement.",Vie Étudiante,Aide financière,https://e-supptic.cm/
Comment s’inscrire aux activités sportives organisées par SUP'PTIC ?,L’inscription aux activités sportives se fait via le bureau de la vie étudiante ou directement sur la plateforme numérique dédiée aux clubs et associations sportives du campus.,Vie Étudiante,Activités extrascolaires,https://e-supptic.cm/
Quels types de logement étudiant sont disponibles à proximité de SUP'PTIC ?,"Plusieurs options de logement sont disponibles à proximité : chambres chez l'habitant, résidences universitaires partenaires, et appartements en location. Le bureau vie étudiante peut vous aider à trouver une solution adaptée.",Vie Étudiante,Logement,https://e-supptic.cm/
Comment participer aux associations et clubs étudiants ?,"Pour rejoindre un club ou une association, vous pouvez vous inscrire lors des journées d’intégration ou contacter directement les responsables via la plateforme étudiante pour plus d’informations.",Vie Étudiante,Vie associative,https://e-supptic.cm/
Quelles sont les ressources disponibles à la bibliothèque de SUP'PTIC ?,"La bibliothèque de SUP'PTIC met à disposition des étudiants des ouvrages spécialisés, des revues scientifiques, des bases de données numériques, ainsi que des espaces de travail en groupe ou en silence.",Vie Étudiante,Ressources pédagogiques,https://e-supptic.cm/
Comment accéder à la plateforme pédagogique en ligne ?,"L’accès à la plateforme pédagogique se fait via votre espace personnel sur le site officiel avec vos identifiants étudiants, permettant de consulter cours, devoirs et notes.",Vie Étudiante,Outils numériques,https://e-supptic.cm/
Quels sont les critères d’évaluation des étudiants à SUP'PTIC ?,"Les étudiants sont évalués par des examens écrits, oraux, travaux pratiques et projets. Les critères précis sont détaillés dans le règlement pédagogique disponible sur le site institutionnel.",Vie Étudiante,Vie académique,https://e-supptic.cm/
Y a-t-il un service d’orientation et de conseil pour les étudiants ?,"Oui, un service d’orientation est disponible pour accompagner les étudiants dans leur parcours académique, professionnel et personnel. Vous pouvez prendre rendez-vous via le portail étudiant.",Vie Étudiante,Orientation,https://e-supptic.cm/
Quels sont les jours de rentrée pour l’année académique à SUP'PTIC ?,La rentrée académique est généralement fixée au début octobre. Les dates précises sont communiquées chaque année via le calendrier officiel publié sur le site.,Vie Étudiante,Planning académique,https://e-supptic.cm/
Puis-je transférer mes crédits d’une autre université vers SUP'PTIC ?,"Le transfert de crédits est possible sous réserve de validation par la commission pédagogique, qui examinera vos relevés de notes et programmes antérieurs afin d’accorder une équivalence.",Vie Étudiante,Mobilité académique,https://e-supptic.cm/
Quels sont les dispositifs de santé et sécurité disponibles pour les étudiants ?,SUP'PTIC dispose d’un service médical d’urgence et d’un protocole de sécurité sur le campus. Des sessions de sensibilisation à la santé et sécurité sont également organisées régulièrement.,Vie Étudiante,Santé et sécurité,https://e-supptic.cm/
Quelle est la politique de SUP'PTIC concernant l’absentéisme ?,L’absentéisme non justifié peut entraîner des avertissements et des sanctions académiques. Les absences doivent être justifiées par un certificat médical ou une autre pièce justificative valide.,Vie Étudiante,Règlement intérieur,https://e-supptic.cm/
Comment soumettre un projet ou un travail de recherche ?,"Les projets ou travaux de recherche doivent être soumis via la plateforme pédagogique selon les instructions fournies par votre encadrant, en respectant les dates limites communiquées.",Vie Étudiante,Recherche étudiante,https://e-supptic.cm/
Quelles sont les opportunités de stages proposées par SUP'PTIC ?,"SUP'PTIC collabore avec plusieurs entreprises locales et internationales pour offrir des stages aux étudiants, accessibles via le bureau des stages qui diffuse régulièrement les offres disponibles.",Vie Étudiante,Stages et insertion professionnelle,https://e-supptic.cm/
Comment puis-je contacter un professeur ou un encadrant ?,"Les coordonnées des enseignants sont disponibles via votre espace étudiant sur la plateforme numérique, où vous pouvez également prendre rendez-vous ou leur envoyer un message direct.",Vie Étudiante,Communication académique,https://e-supptic.cm/
Quels services sont accessibles au bureau de la vie étudiante ?,"Le bureau de la vie étudiante offre un accompagnement pour les activités culturelles, sportives, sociales, ainsi que pour la gestion des clubs et les questions liées à la vie sur le campus.",Vie Étudiante,Support étudiant,https://e-supptic.cm/
Puis-je modifier ma filière après inscription ?,"Un changement de filière est possible sous conditions, après étude du dossier par le service pédagogique et dans le respect des délais fixés par l’administration.",Vie Étudiante,Orientation et parcours,https://e-supptic.cm/
Existe-t-il un système de tutorat entre étudiants ?,"Oui, SUP'PTIC promeut le tutorat entre pairs pour favoriser l’entraide académique. Les étudiants intéressés peuvent s’inscrire auprès du bureau de la vie étudiante.",Vie Étudiante,Accompagnement académique,https://e-supptic.cm/
Comment déclarer une perte de carte d’étudiant ?,"La perte de la carte d’étudiant doit être signalée immédiatement à la scolarité. Une demande de réédition sera alors faite, accompagnée du paiement des frais correspondants.",Vie Étudiante,Documents administratifs,https://e-supptic.cm/
Quelles aides sont proposées pour l’insertion professionnelle après SUP'PTIC ?,"Le service d’insertion professionnelle accompagne les diplômés avec des ateliers, des offres d’emploi, des conseils de rédaction de CV et des sessions de préparation aux entretiens.",Vie Étudiante,Insertion professionnelle,https://e-supptic.cm/
Y a-t-il des événements culturels organisés par l’établissement ?,"Oui, SUP'PTIC organise régulièrement des événements culturels tels que journées portes ouvertes, festivals artistiques, conférences et soirées thématiques pour dynamiser la vie étudiante.",Vie Étudiante,Événements,https://e-supptic.cm/
Comment inscrire un international étudiant à SUP'PTIC ?,"Les étudiants internationaux doivent fournir un dossier complet incluant visa, certificat de nationalité, diplômes traduits, et suivre la procédure d’inscription identique à celle des étudiants nationaux avec un accompagnement dédié.",Vie Étudiante,Inscription,https://e-supptic.cm/
Quels sont les équipements informatiques mis à disposition ?,"Les étudiants peuvent accéder aux salles informatiques équipées d’ordinateurs connectés à internet, ainsi qu'à des logiciels professionnels spécifiques à leur formation.",Vie Étudiante,Infrastructures,https://e-supptic.cm/
Comment fonctionne le club de robotique de SUP'PTIC ?,"Le club de robotique propose des ateliers pratiques, des compétitions et des projets collaboratifs. L’inscription se fait au début de chaque semestre via le bureau des clubs étudiants.",Vie Étudiante,Vie associative,https://e-supptic.cm/
Quels sont les critères pour bénéficier d’un stage rémunéré ?,"Les stages rémunérés sont attribués selon les compétences, le mérite académique, et les disponibilités des entreprises partenaires, avec un dossier de candidature remis au service des stages.",Vie Étudiante,Stages et insertion professionnelle,https://e-supptic.cm/
Comment accéder aux services de restauration sur le campus ?,"Des points de restauration sont disponibles sur le campus, accessibles avec la carte d’étudiant pour bénéficier de tarifs préférentiels. Les horaires et menus sont affichés au sein des différents espaces.",Vie Étudiante,Vie pratique,https://e-supptic.cm/
Quels sont les dispositifs d’aide en cas de stress ou difficultés psychologiques ?,"SUP'PTIC propose un service d’écoute psychologique confidentiel ouvert à tous les étudiants, avec possibilité de rendez-vous en personne ou en ligne pour un accompagnement adapté.",Vie Étudiante,Bien-être étudiant,https://e-supptic.cm/
Peut-on suivre des cours à distance à SUP'PTIC ?,"Oui, SUP'PTIC offre des modalités de cours hybrides ou entièrement en ligne pour certaines formations, afin de répondre aux besoins des étudiants à distance.",Vie Étudiante,Modalités pédagogiques,https://e-supptic.cm/
Comment demander un congé académique ?,La demande de congé académique doit être adressée à la scolarité avec un motif justifié. Elle sera examinée par le comité pédagogique en fonction des règlements en vigueur.,Vie Étudiante,Gestion du parcours,https://e-supptic.cm/
Quels sont les frais supplémentaires pour les étudiants étrangers ?,"Les étudiants étrangers doivent s’acquitter des frais d’inscription et des droits spécifiques administratifs, détaillés dans la grille tarifaire disponible sur le site officiel.",Vie Étudiante,Frais de scolarité,https://e-supptic.cm/
Comment bénéficier d’une validation d’acquis de l’expérience (VAE) ?,"La VAE est possible sous réserve de dépôt d’un dossier complet valorisant votre expérience professionnelle, qui sera analysé par une commission pour attribuer des crédits équivalents aux modules concernés.",Vie Étudiante,Reconnaissance des acquis,https://e-supptic.cm/
Quel accompagnement est offert pour la création d’entreprise ?,"SUP'PTIC propose un programme d’accompagnement entrepreneurial incluant des ateliers, du mentorat et l’accès à un réseau de partenaires pour soutenir la création ou le développement d’entreprises par les étudiants.",Vie Étudiante,Entrepreneuriat étudiant,https://e-supptic.cm/
Comment signaler un incident ou un problème sur le campus ?,"Vous pouvez signaler tout incident au service de sécurité ou via la plateforme de signalement disponible sur le portail étudiant, pour assurer une intervention rapide et efficace.",Vie Étudiante,Sécurité,https://e-supptic.cm/
Y a-t-il des ateliers de développement personnel proposés aux étudiants ?,"Oui, des ateliers sur le développement personnel, gestion du temps, communication et leadership sont régulièrement proposés par le service de la vie étudiante.",Vie Étudiante,Formation complémentaire,https://e-supptic.cm/
Comment puis-je renouveler ma carte d’étudiant chaque année ?,Le renouvellement de la carte se fait automatiquement après validation de votre inscription annuelle et paiement des frais. Vous pouvez retirer votre nouvelle carte au bureau de la scolarité.,Vie Étudiante,Documents administratifs,https://e-supptic.cm/
Quels sont les dispositifs mis en place pour l’égalité des chances ?,"SUP'PTIC garantit l’égalité des chances par des actions telles que des aides financières, des accompagnements spécifiques pour les étudiants en situation de handicap et des programmes d’inclusion sociale.",Vie Étudiante,Inclusion,https://e-supptic.cm/
Comment accéder aux conférences et séminaires organisés par l’institut ?,Les informations concernant les conférences et séminaires sont diffusées via la plateforme étudiante et les panneaux d’affichage. L’accès est généralement gratuit pour tous les étudiants inscrits.,Vie Étudiante,Événements culturels,https://e-supptic.cm/
Quels documents faut-il fournir pour demander une équivalence de diplôme ?,"Vous devez fournir vos diplômes, relevés de notes, programme des cours suivis, ainsi qu’une demande écrite. Le dossier sera examiné par la commission pédagogique pour évaluer l’équivalence.",Vie Étudiante,Reconnaissance des acquis,https://e-supptic.cm/
Quels sont les avantages de la carte étudiante SUP'PTIC ?,"La carte étudiante donne accès aux infrastructures du campus, aux services de restauration, aux réductions sur certains transports et événements culturels, ainsi qu’à la bibliothèque et aux salles informatiques.",Vie Étudiante,Vie pratique,https://e-supptic.cm/
Comment faire une réclamation en cas de problème académique ?,Les réclamations doivent être adressées par écrit au service pédagogique ou via le portail étudiant. Elles sont examinées dans un délai défini avec possibilité d’appel si nécessaire.,Vie Étudiante,Gestion des conflits,https://e-supptic.cm/
Quelles sont les possibilités de mobilité internationale offertes ?,"SUP'PTIC propose des programmes d’échanges internationaux, stages à l’étranger et doubles diplômes en partenariat avec des établissements étrangers, accessibles sous conditions académiques et administratives.",Vie Étudiante,Mobilité académique,https://e-supptic.cm/
Le campus dispose-t-il d’une connexion Wi-Fi pour les étudiants ?,"Oui, une connexion Wi-Fi sécurisée est disponible gratuitement sur l’ensemble du campus pour tous les étudiants munis de leur carte d’accès.",Vie Étudiante,Infrastructures,https://e-supptic.cm/
Quelle est la procédure pour renouveler son visa étudiant ?,Les étudiants étrangers doivent prendre contact avec le bureau des affaires internationales pour obtenir un certificat de scolarité et une attestation d'inscription nécessaire au renouvellement du visa auprès des autorités camerounaises.,Vie Étudiante,Vie administrative,https://e-supptic.cm/
Comment puis-je obtenir un certificat de stage ?,Le certificat de stage est délivré par le service des stages sur présentation de la convention de stage signée et du rapport final validé par le tuteur en entreprise et l’encadrant académique.,Vie Étudiante,Documents administratifs,https://e-supptic.cm/
Quels services d’accompagnement sont proposés aux étudiants en situation de handicap ?,"SUP'PTIC met à disposition un service dédié avec aides techniques, aménagements spécifiques aux examens et accompagnement personnalisé pour faciliter leur intégration et réussite académique.",Vie Étudiante,Inclusion,https://e-supptic.cm/
Comment participer au jury des projets de fin d'études ?,La participation au jury est réservée aux enseignants et experts invités. Les étudiants peuvent assister aux soutenances selon les modalités communiquées par la direction pédagogique.,Vie Étudiante,Vie académique,https://e-supptic.cm/
Quels sont les critères d’accès aux formations professionnelles proposées ?,"L’accès se fait sur dossier académique, parfois complété par un entretien de motivation. Les prérequis varient selon les formations, détaillés dans les fiches pédagogiques sur le site officiel.",Vie Étudiante,Admissions,https://e-supptic.cm/
Comment suivre les résultats académiques en ligne ?,"Les résultats sont publiés sur la plateforme pédagogique accessible avec vos identifiants personnels, où vous pouvez consulter vos notes, moyennes et bulletins officiels.",Vie Étudiante,Vie académique,https://e-supptic.cm/
Y a-t-il une assurance étudiante obligatoire à SUP'PTIC ?,"Oui, tous les étudiants doivent souscrire à une assurance responsabilité civile et santé, soit par le biais de la mutuelle de l’établissement, soit via une assurance privée reconnue.",Vie Étudiante,Vie pratique,https://e-supptic.cm/
Quels sont les critères d’admission en première année à SUP'PTIC ?,"L’admission se base sur l’examen du dossier scolaire du bac ou équivalent, parfois complété par un test d’entrée et un entretien selon la filière choisie.",Vie Étudiante,Admissions,https://e-supptic.cm/
Quelles sont les démarches pour s'inscrire à SUP'PTIC Cameroun ?,"Pour vous inscrire à SUP'PTIC Cameroun, vous devez d'abord remplir le formulaire d'inscription en ligne disponible sur le site officiel, soumettre vos pièces justificatives (relevés de notes, diplôme, pièce d'identité) et procéder au paiement des frais d'inscription. Une fois ces étapes complétées, vous recevrez une confirmation d'admission.",Vie Étudiante,Inscription,https://e-supptic.cm/
Quels sont les services offerts par le bureau de la vie étudiante à SUP'PTIC ?,"Le bureau de la vie étudiante accompagne les étudiants dans la gestion de leur vie quotidienne à SUP'PTIC, incluant l'organisation des activités culturelles et sportives, la gestion des clubs étudiants, le soutien psychologique, ainsi que l'aide pour les questions administratives et sociales.",Vie Étudiante,Services aux étudiants,https://e-supptic.cm/
Comment accéder à la bibliothèque de SUP'PTIC Cameroun ?,"L'accès à la bibliothèque est réservé aux étudiants inscrits et au personnel de SUP'PTIC. Il suffit de présenter votre carte d'étudiant à l'entrée. La bibliothèque offre des ressources en version papier et numérique, ainsi que des espaces de travail calmes pour étudier.",Vie Étudiante,Ressources académiques,https://e-supptic.cm/
Existe-t-il des logements universitaires à proximité de SUP'PTIC ?,"SUP'PTIC ne possède pas de résidences universitaires, mais des partenariats existent avec des résidences privées proches du campus. Le bureau de la vie étudiante peut vous orienter vers ces solutions d'hébergement sécurisées et adaptées aux étudiants.",Vie Étudiante,Logement,https://e-supptic.cm/
Quel est le calendrier académique pour l'année en cours ?,"Le calendrier académique, incluant les dates de rentrée, de fin de semestre, les périodes d'examens et les vacances, est disponible sur le portail étudiant ou via le service scolarité de SUP'PTIC. Il est important de le consulter régulièrement pour suivre les échéances.",Vie Étudiante,Organisation académique,https://e-supptic.cm/
Comment puis-je obtenir une copie de mon relevé de notes à SUP'PTIC ?,"Pour obtenir une copie de votre relevé de notes, vous devez adresser une demande écrite au service scolarité, soit via la plateforme en ligne, soit physiquement au bureau. Un délai de traitement est à prévoir, généralement de quelques jours ouvrables.",Vie Étudiante,Documents administratifs,https://e-supptic.cm/
Quelles activités culturelles sont proposées aux étudiants de SUP'PTIC ?,"SUP'PTIC organise régulièrement des événements culturels tels que des spectacles, expositions, compétitions artistiques et journées thématiques, permettant aux étudiants de s'exprimer et de découvrir diverses cultures dans une ambiance conviviale.",Vie Étudiante,Activités culturelles,https://e-supptic.cm/
Comment rejoindre un club étudiant à SUP'PTIC ?,"Pour rejoindre un club étudiant, vous pouvez contacter directement le bureau de la vie étudiante ou vous inscrire lors des journées dédiées à l'accueil des nouveaux étudiants. Les informations sur les clubs et leurs activités sont aussi publiées sur le site de SUP'PTIC.",Vie Étudiante,Clubs et associations,https://e-supptic.cm/
Quels sont les moyens de transport recommandés pour se rendre au campus de SUP'PTIC ?,"Le campus est accessible en transports en commun tels que taxis et bus urbains. Pour plus de sécurité et de confort, certains étudiants utilisent également le covoiturage ou des services de transport privés. Il est conseillé de vérifier les horaires pour éviter les retards aux cours.",Vie Étudiante,Mobilité,https://e-supptic.cm/
Comment fonctionne le système de notation à SUP'PTIC ?,"Le système de notation à SUP'PTIC est basé sur une échelle de 0 à 20, où 10 est la moyenne minimale pour valider une unité d'enseignement. Les notes sont attribuées à partir des contrôles continus et des examens finals, conformément au règlement pédagogique.",Vie Étudiante,Evaluation académique,https://e-supptic.cm/
Quels sont les dispositifs d'accompagnement pour les étudiants en situation de handicap ?,"SUP'PTIC met en place des dispositifs spécifiques pour accompagner les étudiants en situation de handicap, incluant l'aménagement des locaux, le soutien pédagogique personnalisé, et l'accès facilité aux ressources adaptées. Contactez le bureau de la vie étudiante pour plus d'informations.",Vie Étudiante,Inclusion et accessibilité,https://e-supptic.cm/
Quelles sont les modalités de paiement des frais de scolarité à SUP'PTIC ?,Les frais de scolarité peuvent être payés en ligne via la plateforme dédiée ou directement au guichet de la scolarité. Il est possible de régler en plusieurs versements sous réserve de respecter le calendrier des échéances communiqué en début d'année.,Vie Étudiante,Finance étudiante,https://e-supptic.cm/
Est-il possible de bénéficier d'une bourse d'études à SUP'PTIC ?,"Oui, SUP'PTIC propose des bourses d'études sur critères sociaux et méritocratiques. Les dossiers doivent être déposés auprès du service des affaires estudiantines et sont étudiés selon les disponibilités budgétaires et le mérite des candidats.",Vie Étudiante,Aide financière,https://e-supptic.cm/
Comment consulter mon emploi du temps en ligne ?,"Votre emploi du temps est accessible via l'espace étudiant sur la plateforme SUP'PTIC. Vous pouvez le consulter en temps réel, télécharger ou imprimer les plannings des cours et des examens.",Vie Étudiante,Organisation académique,https://e-supptic.cm/
Quelles sont les règles à respecter lors des examens à SUP'PTIC ?,"Pendant les examens, les étudiants doivent arriver à l'heure, présenter une pièce d'identité, ne pas utiliser de téléphones portables ou autres dispositifs électroniques, et respecter les consignes du surveillant. Toute fraude peut entraîner une exclusion disciplinaire.",Vie Étudiante,Règlement intérieur,https://e-supptic.cm/
Comment signaler un problème de discipline sur le campus ?,"Vous pouvez signaler tout problème de discipline au bureau de la vie étudiante ou au service de la sécurité. Le signalement peut être fait anonymement ou personnellement, après quoi une enquête sera conduite conformément au règlement intérieur.",Vie Étudiante,Discipline et sécurité,https://e-supptic.cm/
Quels types de formations propose SUP'PTIC pour l'année académique ?,"SUP'PTIC propose diverses formations dans le domaine des technologies de l'information, de la communication, du management et de l'ingénierie. Vous pouvez consulter la liste complète des cursus et leurs programmes détaillés sur le site officiel.",Vie Étudiante,Offre académique,https://e-supptic.cm/
Comment puis-je contacter un conseiller pédagogique ?,"Pour contacter un conseiller pédagogique, rendez-vous au bureau de la scolarité ou prenez rendez-vous via la plateforme en ligne. Les conseillers sont disponibles pour vous aider dans vos choix d'orientation et votre parcours académique.",Vie Étudiante,Orientation et conseils,https://e-supptic.cm/
Y a-t-il un service de santé disponible pour les étudiants sur le campus ?,"SUP'PTIC dispose d'un centre de santé étudiant offrant des consultations médicales de base, des conseils en hygiène et prévention, ainsi que des campagnes de sensibilisation. En cas d'urgence, les étudiants sont orientés vers des structures médicales partenaires.",Vie Étudiante,Santé et bien-être,https://e-supptic.cm/
Comment participer aux compétitions sportives organisées par SUP'PTIC ?,"Pour participer aux compétitions sportives, il faut s'inscrire auprès du bureau des sports ou des clubs sportifs du campus. Ces compétitions sont ouvertes à tous les étudiants et encouragent l'esprit d'équipe et la discipline.",Vie Étudiante,Sport étudiant,https://e-supptic.cm/
Quelles sont les possibilités de stage pour les étudiants de SUP'PTIC ?,SUP'PTIC propose un accompagnement pour la recherche de stages dans des entreprises partenaires. Le service des relations professionnelles aide les étudiants à trouver des offres correspondant à leur parcours et valide les conventions de stage.,Vie Étudiante,Insertion professionnelle,https://e-supptic.cm/
