Question,Reponse,Categorie,SousTheme,Source
Puis-je changer de filière après la première année à SUP'PTIC ?,"Le changement de filière est possible sous certaines conditions, notamment en fonction des places disponibles et de la compatibilité des programmes. Une demande motivée doit être déposée auprès de la direction pédagogique qui étudiera votre dossier.",Vie Étudiante,Orientation et parcours,https://e-supptic.cm/
Quels documents dois-je fournir pour une demande de réinscription ?,"Pour la réinscription, vous devez fournir le formulaire complété, la preuve de paiement des frais de scolarité, ainsi que les copies de vos bulletins ou relevés de notes de l'année précédente. La réinscription se fait en ligne ou au bureau de la scolarité.",Vie Étudiante,Inscription,https://e-supptic.cm/
Quel accompagnement propose SUP'PTIC pour la gestion du stress chez les étudiants ?,"SUP'PTIC propose des ateliers de gestion du stress, des séances de soutien psychologique et des activités de bien-être. Le bureau de la vie étudiante propose également des conseils personnalisés pour aider les étudiants à mieux gérer leurs émotions et leur temps.",Vie Étudiante,Santé mentale,https://e-supptic.cm/
Comment obtenir une attestation de scolarité à SUP'PTIC ?,L'attestation de scolarité peut être demandée en ligne via votre espace étudiant ou auprès du service scolarité. Elle est généralement délivrée sous 48 heures et est nécessaire pour diverses démarches administratives ou bancaires.,Vie Étudiante,Documents administratifs,https://e-supptic.cm/
Quels sont les horaires d'ouverture du campus et des services aux étudiants ?,"Le campus est ouvert du lundi au vendredi de 7h30 à 18h00, et le samedi de 8h00 à 12h00. Les services administratifs, tels que la scolarité et la vie étudiante, sont disponibles durant ces horaires, en dehors des jours fériés.",Vie Étudiante,Infos pratiques,https://e-supptic.cm/
Quels sont les équipements disponibles dans les salles informatiques de SUP'PTIC ?,"Les salles informatiques sont équipées d'ordinateurs récents, avec accès à internet haut débit, logiciels professionnels liés aux cursus, imprimantes et scanners. Ces espaces sont accessibles aux étudiants pendant les heures d'ouverture du campus.",Vie Étudiante,Ressources académiques,https://e-supptic.cm/
Comment faire une demande de congé académique à SUP'PTIC ?,"La demande de congé académique doit être adressée par écrit au service scolarité en expliquant les motifs (raison de santé, professionnelle, familiale). Elle est étudiée au cas par cas et nécessite l'accord préalable de la direction pédagogique.",Vie Étudiante,Vie académique,https://e-supptic.cm/
Y a-t-il des activités de sensibilisation sur le développement durable sur le campus ?,"Oui, SUP'PTIC organise régulièrement des campagnes de sensibilisation au développement durable, incluant des conférences, ateliers et actions concrètes comme le tri des déchets et l'économie d'énergie, afin d'impliquer les étudiants dans ces enjeux cruciaux.",Vie Étudiante,Engagement étudiant,https://e-supptic.cm/
Comment fonctionne le tutorat entre étudiants à SUP'PTIC ?,Le tutorat est un programme où des étudiants plus expérimentés accompagnent les nouveaux dans leur intégration académique et sociale. Vous pouvez vous inscrire au tutorat via le bureau de la vie étudiante pour bénéficier de conseils et soutien personnalisés.,Vie Étudiante,Accompagnement pédagogique,https://e-supptic.cm/
Que faire en cas de perte de ma carte d'étudiant ?,"En cas de perte de votre carte d'étudiant, vous devez faire une déclaration officielle auprès du service scolarité et demander une réédition. Des frais peuvent être appliqués pour le remplacement, et votre accès aux services peut être temporairement suspendu.",Vie Étudiante,Documents administratifs,https://e-supptic.cm/
SUP'PTIC propose-t-il des aides pour les étudiants entrepreneurs ?,"Oui, SUP'PTIC encourage l'entrepreneuriat étudiant à travers des ateliers, mentorat, concours d'idées et partenariats avec des incubateurs. Le bureau de la vie étudiante accompagne les porteurs de projets pour les aider à concrétiser leurs initiatives.",Vie Étudiante,Entrepreneuriat étudiant,https://e-supptic.cm/
Comment accéder aux supports de cours en ligne ?,"Les supports de cours sont mis à disposition sur la plateforme pédagogique accessible via votre espace étudiant. Vous pouvez y consulter, télécharger ou participer à des forums de discussion pour approfondir vos connaissances.",Vie Étudiante,Ressources académiques,https://e-supptic.cm/
Quelles sont les règles concernant le respect de l'environnement sur le campus ?,"Les étudiants sont invités à respecter la propreté du campus, à trier leurs déchets, économiser l'eau et l'électricité, et à utiliser des moyens de transport éco-responsables. Des panneaux et campagnes rappellent ces engagements au quotidien.",Vie Étudiante,Développement durable,https://e-supptic.cm/
Comment obtenir une convention de stage signée par SUP'PTIC ?,"Vous devez soumettre votre demande au service des stages avec les informations de l'entreprise d'accueil. Une fois validée, SUP'PTIC signe la convention de stage qui engage toutes les parties pour la durée définie du stage.",Vie Étudiante,Insertion professionnelle,https://e-supptic.cm/
Que faire en cas de conflit avec un enseignant ou un autre étudiant ?,"Il est conseillé d'abord de tenter une résolution directe et respectueuse. En cas d'échec, vous pouvez saisir le médiateur ou le bureau de la vie étudiante qui assure un suivi confidentiel et propose une médiation conformément au règlement intérieur.",Vie Étudiante,Relations interpersonnelles,https://e-supptic.cm/
Comment participer aux élections des délégués étudiants ?,"Les élections ont lieu en début d'année académique. Pour participer, vous devez être inscrit et à jour dans vos obligations. Vous pouvez vous porter candidat ou voter en vous inscrivant auprès du bureau de la vie étudiante qui organise le scrutin.",Vie Étudiante,Vie associative,https://e-supptic.cm/
Y a-t-il un dispositif d'aide alimentaire pour les étudiants en difficulté ?,"SUP'PTIC dispose d'une cellule d'aide sociale qui peut orienter les étudiants en difficulté vers des solutions d'aide alimentaire, notamment via des partenariats avec des associations ou la mise en place d'une cantine solidaire.",Vie Étudiante,Aide sociale,https://e-supptic.cm/
Quels sont les critères pour valider mon année à SUP'PTIC ?,La validation de l'année repose sur l'obtention de la moyenne générale (en général 10/20) et le respect des conditions de présence en cours. Certaines unités peuvent être compensées selon le règlement pédagogique en vigueur.,Vie Étudiante,Evaluation académique,https://e-supptic.cm/
Comment faire une demande de transfert vers un autre établissement ?,"Pour effectuer un transfert, vous devez déposer une demande officielle auprès du service scolarité avec les justificatifs nécessaires (relevés de notes, lettre de motivation). Le dossier sera étudié en fonction des possibilités et accords entre établissements.",Vie Étudiante,Parcours étudiant,https://e-supptic.cm/
Quelles sont les opportunités d’échanges internationaux disponibles ?,SUP'PTIC propose certains programmes d'échanges avec des institutions partenaires à l'international. Ces possibilités incluent des semestres à l'étranger ou des stages internationaux. Contactez le bureau des relations internationales pour plus d'informations.,Vie Étudiante,Mobilité internationale,https://e-supptic.cm/
Comment fonctionne la récupération des notes après un examen raté ?,"Selon le règlement pédagogique, des sessions de rattrapage sont organisées. Vous devez vous inscrire auprès du service scolarité pour y participer. La validation finale dépend des résultats obtenus lors de ces examens de récupération.",Vie Étudiante,Evaluation académique,https://e-supptic.cm/
Quelles sont les règles en matière d'assiduité à SUP'PTIC ?,"L'assiduité est obligatoire pour tous les cours et travaux dirigés. Un seuil minimum de présence est fixé par le règlement, généralement autour de 75%, pour être autorisé à participer aux examens. Tout manquement peut entraîner des sanctions.",Vie Étudiante,Règlement intérieur,https://e-supptic.cm/
Comment participer à l'organisation d’événements étudiants ?,Vous pouvez rejoindre le comité des étudiants ou proposer vos idées auprès du bureau de la vie étudiante. Un calendrier des événements est établi et chacun peut s'impliquer selon ses compétences et disponibilités.,Vie Étudiante,Vie associative,https://e-supptic.cm/
Existe-t-il des ateliers de développement personnel pour les étudiants ?,"Oui, des ateliers sont régulièrement organisés pour améliorer les compétences en communication, gestion du temps, prise de parole, et leadership. Ces sessions sont annoncées via les canaux officiels et sont gratuites pour les étudiants.",Vie Étudiante,Formation continue,https://e-supptic.cm/
Comment signaler un problème technique avec la plateforme en ligne ?,Vous devez adresser votre demande au support technique via le formulaire de contact disponible sur la plateforme. Le service informatique s'engage à répondre dans les plus brefs délais pour résoudre le problème.,Vie Étudiante,Support technique,https://e-supptic.cm/
